{
  "id": "c-e-wikstroms-minnesfond",
  "name": "C E Wikströms Minnesfond",
  "url": "https://www.skr.org/kristen-tro/kyrkorna/frikyrkor/frifo-frikyrkliga-forskningsradet/c-e-wikstroms-minnesfond/",
  "opens": "2025-10-01",
  "deadline": "2025-12-01",
  "recurrence": "annual",
  "apply_via": "website",
  "tags": [
    "forskning"
  ],
  "last_verified": "2026-07-27"
}
