{
  "id": "gustaf-soderbergs-stiftelse",
  "name": "Gustaf Söderbergs Stiftelse",
  "url": "https://avima.app/handelsbankenstiftelsetjanst/issues/publicform/4e359f53-3240-435c-88e0-9bb39a6fc59f",
  "opens": "2026-02-01",
  "deadline": "2026-03-31",
  "recurrence": "annual",
  "apply_via": "website",
  "report_required": true,
  "typical_amount_sek": 8700,
  "tags": [],
  "notes": {
    "sv": "Främjar barns och ungdomars fostran och utbildning samt vård av behövande äldre, sjuka eller funktionsnedsatta. Studerande kan söka till och med 25 års ålder. Förvaltas av Handelsbanken Stiftelsetjänst.",
    "en": "Promotes the upbringing and education of children and young people, and care for elderly, ill or disabled people in need. Students may apply up to the age of 25. Administered by Handelsbanken Stiftelsetjänst."
  },
  "last_verified": "2026-08-21"
}
