{
  "id": "estrid-ericsons-stiftelse",
  "name": "Estrid Ericsons Stiftelse",
  "url": "https://www.estrid-ericsons-stiftelse.nu/Andamal.aspx",
  "opens": null,
  "deadline": "2026-05-01",
  "recurrence": "annual",
  "apply_via": "website",
  "tags": [],
  "last_verified": "2026-07-27",
  "typical_amount_sek": 10000
}
