{
  "id": "understods-och-stipendiefonden-for-utlandsstudier",
  "name": "Understöds- och stipendiefonden för utlandsstudier",
  "url": "https://www.sverigesingenjorer.se/medlemskap/stipendier/Understods-och-stipendiefonden-utlandsstudier/",
  "opens": "2025-12-01",
  "deadline": "2026-03-01",
  "recurrence": "annual",
  "apply_via": "website",
  "tags": [
    "utlandsstudier",
    "medlemskap"
  ],
  "last_verified": "2026-07-27",
  "notes": {
    "sv": "Kräver medlemskap i Sveriges Ingenjörer.",
    "en": "Requires membership in Sveriges Ingenjörer."
  }
}
