{
  "id": "sven-och-ragnhild-belfrages-stiftelse",
  "name": "Sven och Ragnhild Belfrages Stiftelse",
  "url": "https://www.stiftelseansokan.se/Category/ShowTrusts?searchString=Sven+och+Ragnhild",
  "opens": "2025-10-07",
  "deadline": "2025-11-07",
  "recurrence": "annual",
  "apply_via": "website",
  "tags": [],
  "last_verified": "2026-07-27"
}
