{
  "id": "richertska-stiftelsen-fou-anslag",
  "name": "Richertska Stiftelsen – FoU-anslag",
  "url": "https://www.sweco.se/om-sweco-sverige/stipendier-och-forskningsanslag/richterska-stiftelsen/",
  "opens": "2026-02-01",
  "deadline": "2026-03-31",
  "recurrence": "annual",
  "apply_via": "website",
  "tags": [
    "forskning"
  ],
  "last_verified": "2026-07-27"
}
