{
  "id": "sten-k-johnsons-stiftelse",
  "name": "Sten K Johnsons Stiftelse",
  "url": "https://www.stenkjohnsonsstiftelse.se/om-stiftelsen/",
  "opens": "2026-01-16",
  "deadline": "2026-02-13",
  "recurrence": "annual",
  "apply_via": "website",
  "tags": [
    "kultur",
    "forskning"
  ],
  "last_verified": "2026-07-27"
}
