{
  "id": "sif-och-lena-sellbergs-stiftelse-for-utbildning-och-forskning",
  "name": "Sif och Lena Sellbergs Stiftelse för utbildning och forskning",
  "url": "https://stiftelseansokan.se/Category/ShowTrusts?categoryId=3",
  "opens": "2026-03-01",
  "deadline": "2026-05-01",
  "recurrence": "annual",
  "apply_via": "website",
  "tags": [
    "forskning"
  ],
  "last_verified": "2026-07-27"
}
