{
  "id": "bernt-gustavssons-fond-chalmers",
  "name": "Bernt Gustavssons Fond (Chalmers)",
  "url": "https://www.chalmers.se/utbildning/studera-hos-oss/studentliv/stipendier-for-studenter/bernt-gustavssons-fond/",
  "opens": "2025-12-15",
  "deadline": "2026-02-10",
  "recurrence": "annual",
  "apply_via": "website",
  "tags": [
    "chalmers"
  ],
  "last_verified": "2026-07-27",
  "notes": {
    "sv": "Endast för Chalmersstudenter.",
    "en": "Chalmers students only."
  }
}
