{
  "id": "eldorado-stipendium",
  "name": "Eldorado Stipendium",
  "url": "https://www.eldoradovaror.se/eldorado-stipendium/",
  "opens": "2025-12-01",
  "deadline": "2026-01-06",
  "recurrence": "annual",
  "apply_via": "website",
  "tags": [
    "foretagsstipendium"
  ],
  "notes": {
    "sv": "För studenter med en lösning, insikt, fråga eller hypotes som de vill utveckla från idé till verklighet. Ansökningsperiod 1 december–6 januari.",
    "en": "For students with a solution, insight, question or hypothesis they want to develop from idea to reality. Application window 1 December–6 January."
  },
  "last_verified": "2026-08-21"
}
