{
  "id": "tage-swahns-stiftelse-for-undervisning-och-forskning",
  "name": "Tage Swahns Stiftelse för undervisning och forskning",
  "url": "https://www.stiftelseansokan.se/Category/ShowTrusts?categoryId=1",
  "opens": "2025-09-01",
  "deadline": "2025-10-31",
  "recurrence": "annual",
  "apply_via": "website",
  "tags": [
    "forskning"
  ],
  "notes": {
    "sv": "Söks via portalen stiftelseansokan.se. Främjar vetenskaplig undervisning och forskning samt ungdomars fostran och utbildning; anslag går till forskare och till vetenskapliga eller kulturella institutioner och skolor.",
    "en": "Applied for through the stiftelseansokan.se portal. Promotes scientific teaching and research and the upbringing and education of young people; grants go to researchers and to scientific or cultural institutions and schools."
  },
  "last_verified": "2026-08-21"
}
